### ISSUE TITLE
Canary Demo Failure

### ISSUE THREAD

**Issue by owenchenxy** [kubevela/kubevela#6328]
**Describe the bug**
I follow the document to do canary demo, but when it comes to the [Day2 Release Step](https://kubevela.io/docs/end-user/traits/rollout/#day-2-canary-release), error occurred like below:
```
vela status canary-demo
About:

  Name:         canary-demo                  
  Namespace:    default                      
  Created at:   2023-09-06 17:20:32 +0800 CST
  Status:       runningWorkflow              

Workflow:

  mode: StepByStep-DAG
  finished: false
  Suspend: false
  Terminated: false
  Steps
  - id: atqwse4pol
    name: rollout-20
    type: canary-deploy
    phase: failed 
    message: run step(provider=multicluster,do=deploy): Found 1 errors. [(error encountered in cluster local: Dispatch: pre-dispatch dryrun failed: Found 1 errors. [(cannot create object: Internal error occurred: failed calling webhook "vrollout.kb.io": failed to call webhook: Post "https://kruise-rollout-webhook-service.kruise-rollout.svc:443/validate-rollouts-kruise-io-rollout?timeout=10s": context deadline exceeded)])]

Services:

  - Name: canary-demo  
    Cluster: local  Namespace: default
    Type: webservice
    Healthy Ready:5/5
    Traits:
      ✅ scaler      ✅ gateway: Host not specified, visit the cluster or load balancer in front of the cluster
```

I searched in the kruise controller log, only shows below message, noting else
```
│ I0906 09:32:26.029617       1 webhook_controller.go:229] Starting to sync webhook certs and configurations                                                                                  │
│ I0906 09:32:26.050038       1 webhook_controller.go:231] Finished to sync webhook certs and configurations
```

I also tried to execute command in the vela core pod to check the network, it shows network is good:
```
kubevela-vela-core-85fd59d846-gggkd:/# nc -zv kruise-rollout-webhook-service.kruise-rollout.svc 443
kruise-rollout-webhook-service.kruise-rollout.svc (172.20.89.87:443) open
```

Could someone kindly give me some hint on this?

**Comment by owenchenxy** [comment]
I tried to recreate the kruise rollout controller but it did not help

**Comment by owenchenxy** [comment]
versions:
oamdev/cluster-gateway:v1.9.0-alpha.2
oamdev/vela-core:v1.9.6
openkruise/kruise-rollout:v0.3.0

**Comment by owenchenxy** [comment]
I did some further debugging:

the IP address of the pods are as below:
|POD|IP|
|--|--|
|kruise-rollout-controller-manager |10.0.1.116|
|kube-apiserver |172.20.0.1|
|vela-core | 10.0.2.15 |

I captured packages on pod `kruise-rollout-controller-manager`, I can tell that the communication between api server and kruise controller is good
```
67106	4532.455569	10.0.1.116	172.20.0.1	TCP	72	33224 → 443 [ACK] Seq=605249 Ack=1854629 Win=565760 Len=0 TSval=1089565515 TSecr=2696638333
67107	4532.456154	10.0.1.116	172.20.0.1	TLSv1.3	113	Application Data
67108	4532.456190	10.0.1.116	172.20.0.1	TLSv1.3	879	Application Data
67109	4532.456969	172.20.0.1	10.0.1.116	TCP	72	443 → 33224 [ACK] Seq=1854629 Ack=606097 Win=1265152 Len=0 TSval=2696638335 TSecr=1089565515
67110	4532.463185	172.20.0.1	10.0.1.116	TLSv1.3	138	Application Data
67111	4532.463187	172.20.0.1	10.0.1.116	TLSv1.3	879	Application Data
67112	4532.463266	10.0.1.116	172.20.0.1	TCP	72	33224 → 443 [ACK] Seq=606097 Ack=1855502 Win=565760 Len=0 TSval=1089565522 TSecr=2696638341
67113	4533.324860	172.20.0.1	10.0.1.116	TLSv1.3	103	Application Data
67114	4533.325180	10.0.1.116	172.20.0.1	TLSv1.3	227	Application Data
67115	4533.327110	172.20.0.1	10.0.1.116	TLSv1.3	160	Application Data
67116	4533.368372	10.0.1.116	172.20.0.1	TCP	72	33224 → 443 [ACK] Seq=606252 Ack=1855621 Win=565760 Len=0 TSval=1089566428 TSecr=2696639205
67117	4534.464378	10.0.1.116	172.20.0.1	TLSv1.3	111	Application Data
67118	4534.470510	172.20.0.1	10.0.1.116	TLSv1.3	162	Application Data
```

Then I tried to capture some traffic for analysis when the error occurs, but I got nothing. I suspected that the domain or port of the kruise rollout webhook service is not open, so I ran netcat command for a test:
```
nc -zv kruise-rollout-webhook-service.kruise-rollout.svc 443
``` 

The result is good and I got traffic captured indeed:
```
5871	385.225336	10.0.2.15	10.0.1.116	TCP	80	38813 → 9876 [SYN] Seq=0 Win=62727 Len=0 MSS=8961 SACK_PERM TSval=3871879005 TSecr=0 WS=128
5872	385.225352	10.0.1.116	10.0.2.15	TCP	80	9876 → 38813 [SYN, ACK] Seq=0 Ack=1 Win=62643 Len=0 MSS=8961 SACK_PERM TSval=3474744281 TSecr=3871879005 WS=128
5873	385.226038	10.0.2.15	10.0.1.116	TCP	72	38813 → 9876 [ACK] Seq=1 Ack=1 Win=62848 Len=0 TSval=3871879005 TSecr=3474744281
5874	385.226123	10.0.2.15	10.0.1.116	TCP	72	38813 → 9876 [FIN, ACK] Seq=1 Ack=1 Win=62848 Len=0 TSval=3871879006 TSecr=3474744281
5875	385.226274	10.0.1.116	10.0.2.15	TCP	72	9876 → 38813 [FIN, ACK] Seq=1 Ack=2 Win=62720 Len=0 TSval=3474744281 TSecr=3871879006
5876	385.226960	10.0.2.15	10.0.1.116	TCP	72	38813 → 9876 [ACK] Seq=2 Ack=2 Win=62848 Len=0 TSval=3871879006 TSecr=3474744281
53198	3590.077212	10.0.2.15	10.0.1.116	TCP	80	42965 → 9876 [SYN] Seq=0 Win=62727 Len=0 MSS=8961 SACK_PERM TSval=3875083857 TSecr=0 WS=128
53199	3590.077228	10.0.1.116	10.0.2.15	TCP	80	9876 → 42965 [SYN, ACK] Seq=0 Ack=1 Win=62643 Len=0 MSS=8961 SACK_PERM TSval=3477949132 TSecr=3875083857 WS=128
```

I don't know why this could happen, since the webhook url is correct and network is good, but no request is recieved in kruise

**Comment by owenchenxy** [comment]
Then I tried to capture traffic on vela core pod, I found that there's no outbound traffic with dst of kruise-webhooks pod ip or svc ip address.

**Comment by owenchenxy** [comment]
I searched the error message in the code, matches this line:

https://github.com/kubevela/kubevela/blob/9c57c098783fabeb76428cf88720a5a02ca641ee/pkg/resourcekeeper/dispatch.go#L80C1-L81C1 

Looks like the lint check of the manifest failed, I entirely copied the command in the docs, could someone check if there is some config syntax error?

**Comment by owenchenxy** [comment]
This only happens on AWS EKS cluster, demo works good on Azure AKS cluster

**Comment by briankane** [comment]
This issue has been inactive for over 2 years and is scheduled for closure as part of our backlog maintenance.

  **If this issue is still relevant:**
  - Please comment below to keep it open
  - Provide updated context if the original description is outdated

  **Timeline:** If there's no activity by **Friday, October 24th**, this issue will be automatically closed.

  **Note:** Issues can always be reopened if they become relevant again. We encourage the community to reopen and reprioritize any incorrectly 
  closed issues.

**Comment by briankane** [comment]
This issue has been closed following the stale issue notice. 

If this issue is still relevant and should remain open, please:
1. Reopen the issue
2. Remove the 'stale' label
3. Provide an update on the current status or importance

Thank you for your understanding and contribution to KubeVela!
